Великий пожар Лондона;Great Fire of London;02.09.1666;событие;event
Начало Великой французской революции;Start of the French Revolution;14.07.1789;событие;event
Принятие Декларации независимости США;Adoption of the U.S. Declaration of Independence;04.07.1776;событие;event
Великая чума в Лондоне;Great Plague of London;01.01.1665;событие;event
Битва при Ватерлоо;Battle of Waterloo;18.06.1815;событие;event
Восстание декабристов;Decembrist Revolt;14.12.1825;событие;event
Убийство Авраама Линкольна;Assassination of Abraham Lincoln;15.04.1865;событие;event
Открытие пенициллина;Discovery of Penicillin;28.09.1928;событие;event
Варшавское гетто восстание;Warsaw Ghetto Uprising;19.04.1943;событие;event
Начало Второй мировой войны;Start of World War II;01.09.1939;событие;event
Открытие радиоактивности;Discovery of Radioactivity;01.03.1896;событие;event
Великая депрессия;The Great Depression;29.10.1929;событие;event
Взятие Бастилии;Storming of the Bastille;14.07.1789;событие;event
Начало Индустриальной революции;Start of the Industrial Revolution;01.01.1760;событие;event
Начало Первой мировой войны;Start of World War I;28.07.1914;событие;event
Битва за Британию;Battle of Britain;10.07.1940;событие;event
Подписание Версальского договора;Signing of the Treaty of Versailles;28.06.1919;событие;event
Атомная бомбардировка Хиросимы;Atomic Bombing of Hiroshima;06.08.1945;событие;event
Начало Холодной войны;Start of the Cold War;01.01.1947;событие;event
Полёт Юрия Гагарина;Yuri Gagarin's Flight;12.04.1961;событие;event
Высадка на Луну;Moon Landing;20.07.1969;событие;event
Начало Гражданской войны в США;Start of the American Civil War;12.04.1861;событие;event
Битва при Трафальгаре;Battle of Trafalgar;21.10.1805;событие;event
Смерть Наполеона;Death of Napoleon;05.05.1821;событие;event
Открытие Антарктиды;Discovery of Antarctica;28.01.1820;событие;event
Открытие Тасмании;Discovery of Tasmania;24.11.1642;событие;event
Первая публикация теории относительности Эйнштейна;First Publication of Einstein's Theory of Relativity;30.06.1905;событие;event
Начало Тридцатилетней войны;Start of the Thirty Years' War;23.05.1618;событие;event
Сражение при Лейпциге;Battle of Leipzig;16.10.1813;событие;event
Образование Королевства Великобритания;Formation of the Kingdom of Great Britain;01.05.1707;событие;event
Битва при Аустерлице;Battle of Austerlitz;02.12.1805;событие;event
Начало Американской революции;Start of the American Revolution;19.04.1775;событие;event
Подписание Билля о правах США;Signing of the U.S. Bill of Rights;15.12.1791;событие;event
Смерть королевы Елизаветы I;Death of Queen Elizabeth I;24.03.1603;событие;event
Открытие Кейптауна;Founding of Cape Town;06.04.1652;событие;event
Казнь короля Карла I;Execution of King Charles I;30.01.1649;событие;event
Открытие Австралии Джеймсом Куком;Discovery of Australia by James Cook;29.04.1770;событие;event
Начало Семилетней войны;Start of the Seven Years' War;29.08.1756;событие;event
Основание Сиднея;Founding of Sydney;26.01.1788;событие;event
Линчевание Царя Николая II и его семьи;Execution of Tsar Nicholas II and his family;17.07.1918;событие;event
Подписание Мюнхенского соглашения;Signing of the Munich Agreement;30.09.1938;событие;event
Первая битва при Бул-Ране;First Battle of Bull Run;21.07.1861;событие;event
Провозглашение Германской империи;Proclamation of the German Empire;18.01.1871;событие;event
Освобождение Парижа;Liberation of Paris;25.08.1944;событие;event
Начало Русско-турецкой войны;Start of the Russo-Turkish War;24.04.1877;событие;event
Введение Григорианского календаря;Introduction of the Gregorian Calendar;15.10.1582;событие;event
Обнаружение Трои Генрихом Шлиманом;Discovery of Troy by Heinrich Schliemann;09.10.1871;событие;event
Начало революции 1848 года во Франции;Start of the 1848 Revolution in France;22.02.1848;событие;event
Провозглашение Первой Французской республики;Proclamation of the First French Republic;21.09.1792;событие;event
Начало Войны за испанское наследство;Start of the War of Spanish Succession;01.11.1701;событие;event
Начало правления Петра Великого;Start of Peter the Great's Reign;07.05.1682;событие;event
Основание Ямайки;Founding of Jamaica;10.05.1655;событие;event
Открытие Новой Зеландии;Discovery of New Zealand;13.12.1642;событие;event
Начало колонизации Америки;Start of Colonization of America;14.05.1607;событие;event
Первый полёт братьев Райт;First Flight by the Wright Brothers;17.12.1903;событие;event
Начало строительства Панамского канала;Start of Panama Canal Construction;01.01.1881;событие;event
Начало Английской гражданской войны;Start of the English Civil War;22.08.1642;событие;event
Подписание Акта о навигации;Signing of the Navigation Acts;09.10.1651;событие;event
Основание Плимутской колонии;Founding of Plymouth Colony;21.12.1620;событие;event
Начало войны за австрийское наследство;Start of the War of Austrian Succession;16.12.1740;событие;event
Открытие реки Амазонка;Discovery of the Amazon River;26.08.1542;событие;event
Начало Революции Мэйдзи в Японии;Start of the Meiji Restoration in Japan;03.01.1868;событие;event
Начало Крымской войны;Start of the Crimean War;04.10.1853;событие;event
Начало Гаитянской революции;Start of the Haitian Revolution;22.08.1791;событие;event
Начало восстания Тайпинов;Start of the Taiping Rebellion;01.01.1851;событие;event
Начало второй опиумной войны;Start of the Second Opium War;08.10.1856;событие;event
Падение династии Мин;Fall of the Ming Dynasty;25.04.1644;событие;event
Основание первой британской колонии в Австралии;Founding of the First British Colony in Australia;18.01.1788;событие;event
Начало Войны трёх королевств;Start of the War of the Three Kingdoms;23.10.1641;событие;event
Начало второй англо-бурской войны;Start of the Second Boer War;11.10.1899;событие;event
Начало восстания Спартака;Start of the Spartacus Rebellion;21.12.1919;событие;event
Открытие Мачу-Пикчу;Discovery of Machu Picchu;24.07.1911;событие;event
Основание Джеймстауна;Founding of Jamestown;14.05.1607;событие;event
Начало войны за баварское наследство;Start of the War of Bavarian Succession;03.07.1778;событие;event
Начало войны за независимость Греции;Start of the Greek War of Independence;25.03.1821;событие;event
Начало франко-прусской войны;Start of the Franco-Prussian War;19.07.1870;событие;event
Начало восстания сипаев;Start of the Indian Rebellion of 1857;10.05.1857;событие;event
Начало восстания боксёров;Start of the Boxer Rebellion;02.11.1899;событие;event
Начало первой опиумной войны;Start of the First Opium War;18.03.1839;событие;event
Образование Германской империи;Formation of the German Empire;18.01.1871;событие;event
Начало войны за испанское наследство;Start of the War of Spanish Succession;09.07.1701;событие;event
Битва при Геттисберге;Battle of Gettysburg;01.07.1863;событие;event
Основание колонии Роанок;Founding of the Roanoke Colony;22.07.1587;событие;event
Начало религиозных войн во Франции;Start of the French Wars of Religion;01.03.1562;событие;event
Начало первой англо-голландской войны;Start of the First Anglo-Dutch War;10.07.1652;событие;event
Начало великой северной войны;Start of the Great Northern War;22.02.1700;событие;event
Образование Великобритании;Formation of Great Britain;01.05.1707;событие;event
Начало осады Мальты;Start of the Siege of Malta;18.05.1565;событие;event
Взятие крепости Бастилии;Storming of the Bastille;14.07.1789;событие;event
Открытие Новой Голландии;Discovery of New Holland;26.01.1788;событие;event
Основание города Сидней;Founding of Sydney;26.01.1788;событие;event
Образование Соединённых Штатов Америки;Formation of the United States of America;04.07.1776;событие;event
Первая англо-афганская война;First Anglo-Afghan War;01.10.1839;событие;event
Открытие континента Австралии;Discovery of the Continent of Australia;29.04.1770;событие;event
Основание города Сан-Франциско;Founding of San Francisco;29.06.1776;событие;event
Основание города Нью-Йорк;Founding of New York City;27.08.1664;событие;event
Атомная бомбардировка Нагасаки;Atomic Bombing of Nagasaki;09.08.1945;событие;event
Открытие острова Пасхи;Discovery of Easter Island;05.04.1722;событие;event
Открытие Гавайских островов;Discovery of the Hawaiian Islands;18.01.1778;событие;event
Основание Питера;Founding of St. Petersburg;27.05.1703;событие;event
Начало восстания на крейсере «Потёмкин»;Start of the Potemkin Mutiny;27.06.1905;событие;event
Открытие Новой Шотландии;Discovery of Nova Scotia;11.08.1604;событие;event
Начало экспедиции Фрэнсиса Дрейка;Start of Francis Drake's Expedition;15.12.1577;событие;event
Открытие острова Тасмания;Discovery of Tasmania;24.11.1642;событие;event
Основание Плимута;Founding of Plymouth;21.12.1620;событие;event
Начало Великой северной войны;Start of the Great Northern War;22.02.1700;событие;event
Основание города Новая Амстердам;Founding of New Amsterdam;27.05.1626;событие;event
Начало франко-индейской войны;Start of the French and Indian War;28.05.1754;событие;event
Начало гражданской войны в Англии;Start of the English Civil War;22.08.1642;событие;event
Начало третьей опиумной войны;Start of the Third Opium War;13.01.1857;событие;event
Открытие Северного полюса;Discovery of the North Pole;06.04.1909;событие;event
Основание колонии Массачусетс;Founding of the Massachusetts Colony;09.06.1628;событие;event
Начало второй англо-голландской войны;Start of the Second Anglo-Dutch War;04.03.1665;событие;event
Начало Революции в Нидерландах;Start of the Dutch Revolution;10.08.1566;событие;event
Подписание Акта о навигации;Signing of the Navigation Act;09.10.1651;событие;event
Начало Французской революции;Start of the French Revolution;14.07.1789;событие;event
Подписание Акта о союзе;Signing of the Act of Union;01.01.1707;событие;event
Начало Великой депрессии;Start of the Great Depression;29.10.1929;событие;event
Начало освоения Сибири;Start of the Siberian Conquest;23.06.1581;событие;event
Начало колонизации Северной Америки;Start of the Colonization of North America;14.05.1607;событие;event
Открытие Южного континента;Discovery of the Southern Continent;24.08.1559;событие;event
Начало первой англо-афганской войны;Start of the First Anglo-Afghan War;01.10.1839;событие;event
Начало колонизации Австралии;Start of the Colonization of Australia;18.01.1788;событие;event
Изобретение парового двигателя Джеймсом Уаттом;Invention of the Steam Engine by James Watt;05.01.1776;событие;event
Открытие острова Маврикий;Discovery of Mauritius;02.09.1598;событие;event
Принятие Хартии прав человека;Adoption of the Charter of Human Rights;10.12.1948;событие;event
Запуск первого спутника;Launch of the First Satellite;04.10.1957;событие;event
Подписание акта о Навигации;Signing of the Navigation Act;09.10.1651;событие;event
"Публикация ""Происхождения видов"" Дарвина";" Publication of ""On the Origin of Species"" by Darwin";24.11.1859;событие;event
Первая передача радиосигнала;First Radio Transmission;24.12.1906;событие;event
Принятие Закона о правах;Passage of the Bill of Rights;15.12.1791;событие;event
Провозглашение Соединённых Штатов Америки;Proclamation of the United States of America;04.07.1776;событие;event
Сражение при Геттисберге;Battle of Gettysburg;01.07.1863;событие;event
Изобретение электромагнитной индукции;Invention of Electromagnetic Induction;29.08.1831;событие;event
Запуск первого коммерческого компьютера;Launch of the First Commercial Computer;01.06.1951;событие;event
Первое использование атомной энергии;First Use of Atomic Energy;16.07.1945;событие;event
Первая публикация «Власть труда» Карла Маркса;" First Publication of ""The Power of Labor"" by Karl Marx";28.09.1848;событие;event
Публикация «Капитал» Карла Маркса;" Publication of ""Das Kapital"" by Karl Marx";14.09.1867;событие;event
Битва при Дюнкерке;Battle of Dunkirk;26.05.1940;событие;event
Принятие Конституции США;Adoption of the U.S. Constitution;17.09.1787;событие;event
Изобретение телефона Александром Грэмом Беллом;Invention of the Telephone by Alexander Graham Bell;14.03.1876;событие;event
Изобретение парашюта;Invention of the Parachute;26.12.1783;событие;event
Первая публикация «Капитал» Карла Маркса;" First Publication of ""Das Kapital"" by Karl Marx";14.09.1867;событие;event
Первое использование электромагнитной индукции;First Use of Electromagnetic Induction;29.08.1831;событие;event
Битва при Плевне;Battle of Plevna;30.08.1877;событие;event
Открытие Луны;Discovery of the Moon;30.07.1609;событие;event
Первое использование парового двигателя;First Use of the Steam Engine;05.01.1776;событие;event
Изобретение электрической лампочки;Invention of the Light Bulb;04.09.1879;событие;event
Первая публикация «Происхождения видов» Дарвина;" First Publication of ""On the Origin of Species"" by Darwin";24.11.1859;событие;event
Принятие Декларации независимости США;Adoption of the Declaration of Independence;04.07.1776;событие;event
Открытие новой планеты;Discovery of a New Planet;01.01.1781;событие;event
Изобретение радио;Invention of the Radio;12.12.1901;событие;event
Изобретение парового двигателя;Invention of the Steam Engine;05.01.1776;событие;event
Открытие Австралии;Discovery of Australia;29.04.1770;событие;event
Битва при Суворове;Battle of Suvorov;03.09.1799;событие;event
Открытие Острова Пасхи;Discovery of Easter Island;05.04.1722;событие;event
Подписание Акта о Навигации;Signing of the Navigation Act;09.10.1651;событие;event
Открытие островов Тихого океана;Discovery of the Pacific Islands;12.12.1700;событие;event
"Первая публикация ""Происхождения видов"" Дарвина";" First Publication of ""On the Origin of Species"" by Darwin";24.11.1859;событие;event
"Первая публикация ""Капитал"" Карла Маркса";" First Publication of ""Das Kapital"" by Karl Marx";14.09.1867;событие;event
Подписание Декларации прав человека;Signing of the Declaration of Human Rights;10.12.1948;событие;event
"Публикация ""Капитал"" Карла Маркса";" Publication of ""Das Kapital"" by Karl Marx";14.09.1867;событие;event
Открытие Маврикия;Discovery of Mauritius;02.09.1598;событие;event
Открытие планет Урана;Discovery of Uranus;13.03.1781;событие;event
Изобретение телефонного аппарата;Invention of the Telephone Apparatus;14.03.1876;событие;event
Запуск первого космического спутника;Launch of the First Space Satellite;04.10.1957;событие;event
Смерть Наполеона Бонапарта;Death of Napoleon Bonaparte;05.05.1821;событие;event
Первое использование электрического тока;First Use of Electric Current;25.12.1800;событие;event
"Первая публикация ""Власть труда"" Карла Маркса";" First Publication of ""The Power of Labor"" by Karl Marx";28.09.1848;событие;event
Битва при Бородино;Battle of Borodino;05.09.1812;событие;event
Подписание Декларации прав человека и гражданина;Signing of the Declaration of the Rights of Man and of the Citizen;26.08.1789;событие;event
Первая эксплуатация поезда;First Operation of a Train;27.09.1825;событие;event
Принятие Конституции Франции;Adoption of the French Constitution;03.09.1791;событие;event
Публикация «Происхождения видов» Дарвина;" Publication of ""On the Origin of Species"" by Darwin";24.11.1859;событие;event
Запуск первого атомного подводного лодки;Launch of the First Nuclear Submarine;21.12.1954;событие;event
Основание Новой Англии;Founding of New England;16.09.1620;событие;event
Публикация «О духе законов» Монтескье;" Publication of ""The Spirit of the Laws"" by Montesquieu";01.01.1748;событие;event
Публикация «О происхождении видов» Дарвина;" Publication of ""On the Origin of Species"" by Darwin";24.11.1859;событие;event
Подписание Хартии прав человека;Signing of the Charter of Human Rights;10.12.1948;событие;event
Сражение при Садовом;Battle of the White Mountain;08.11.1620;событие;event
Первая эксплуатация парового локомотива;First Operation of a Steam Locomotive;27.09.1825;событие;event
Изобретение рентгеновских лучей;Invention of X-Rays;08.11.1895;событие;event
Подписание Декларации независимости США;Signing of the Declaration of Independence;04.07.1776;событие;event
"Публикация ""О духе законов"" Монтескье";" Publication of ""The Spirit of the Laws"" by Montesquieu";01.01.1748;событие;event
Изобретение телефона;Invention of the Telephone;14.03.1876;событие;event
Сражение при Гаване;Battle of Havana;14.08.1762;событие;event
"Публикация ""Происхождение видов"" Дарвина";" Publication of ""On the Origin of Species"" by Darwin";24.11.1859;событие;event
Первое использование радиоволн;First Use of Radio Waves;24.12.1906;событие;event
Публикация «Происхождение видов» Дарвина;" Publication of ""On the Origin of Species"" by Darwin";24.11.1859;событие;event
"Первая публикация ""Новой Атлантиды"" Фрэнсиса Бэкона";" First Publication of ""New Atlantis"" by Francis Bacon";01.01.1627;событие;event
"Публикация ""Опыт о человеке"" Декарта";" Publication of ""Discourse on the Method"" by Descartes";01.01.1637;событие;event
Первая экспедиция к Южному полюсу;First Expedition to the South Pole;14.12.1911;событие;event
"Публикация ""Принципы математики"" Ньютона";" Publication of ""Mathematical Principles"" by Newton";05.07.1687;событие;event
Первое наблюдение солнцепёков;First Observation of Solar Flares;01.01.1859;событие;event
Начало первой мировой войны;Start of World War I;28.07.1914;событие;event
"Первая публикация ""Словаря"" Ларошфуко";" First Publication of ""The Dictionary"" by La Rochefoucauld";01.01.1665;событие;event
"Публикация ""Размышления"" Паскаля";" Publication of ""Pens?es"" by Pascal";01.01.1670;событие;event
"Первая публикация ""Опыт о человеке"" Декарта";" First Publication of ""Discourse on the Method"" by Descartes";01.01.1637;событие;event
Изобретение первой пишущей машинки;Invention of the First Typewriter;01.01.1868;событие;event
"Публикация ""Чтение о натуралистах"" Линнея";" Publication of ""Systema Naturae"" by Linnaeus";01.01.1735;событие;event
Сражение при Дюнкерке;Battle of Dunkirk;26.05.1940;событие;event
"Публикация ""Рассуждения о методе"" Декарта";" Publication of ""Discourse on the Method"" by Descartes";01.01.1637;событие;event
Битва при Лейпциге;Battle of Leipzig;16.10.1813;событие;event
Основание Исландии;Founding of Iceland;01.01.1543;событие;event
"Публикация ""О вращении небесных сфер"" Коперника";" Publication of ""On the Revolutions of the Celestial Spheres"" by Copernicus";05.05.1543;событие;event
Начало Пятидесятилетней войны;Start of the Eighty Years' War;01.07.1568;событие;event
"Публикация ""Генерации"" Гассенди";" Publication of ""Syntagma Philosophicum"" by Gassendi";01.01.1658;событие;event
Открытие Японских островов;Discovery of Japan;01.01.1597;событие;event
Смерть Людовика XIV;Death of Louis XIV;01.09.1715;событие;event
"Публикация ""Генерация"" Гассенди";" Publication of ""Syntagma Philosophicum"" by Gassendi";01.01.1658;событие;event
Смерть Исаака Ньютона;Death of Isaac Newton;20.03.1727;событие;event
Подписание Парижского договора;Signing of the Treaty of Paris;03.09.1783;событие;event
