Начало Революции 1848 года;Start of the 1848 Revolution;22.02.1848;событие;event
Основание Сан-Франциско;Founding of San Francisco;29.06.1776;событие;event
"Публикация ""Власть труда"" Карла Маркса";" Publication of ""The Power of Labor"" by Karl Marx";28.09.1848;событие;event
"Публикация ""Словарь"" Ларошфуко";" Publication of ""The Dictionary"" by La Rochefoucauld";01.01.1665;событие;event
Сражение при Ватерлоо;Battle of Waterloo;18.06.1815;событие;event
Сражение при Трафальгаре;Battle of Trafalgar;21.10.1805;событие;event
Начало Великой Революции в Китае;Beginning of the Great Chinese Revolution;01.01.1911;событие;event
Открытие Великого канала;Opening of the Grand Canal;01.01.1644;событие;event
"Публикация ""Рассуждение о методе"" Декарта";" Publication of ""Discourse on the Method"" by Descartes";01.01.1637;событие;event
Начало Промышленной революции в Англии;Start of the Industrial Revolution in England;01.01.1760;событие;event
Открытие первого университета в Америке;Establishment of the First American University;01.01.1636;событие;event
Изобретение первой машины для письма;Invention of the First Typewriter;01.01.1867;событие;event
"Публикация ""О происхождении видов"" Дарвина";" Publication of ""On the Origin of Species"" by Darwin";24.11.1859;событие;event
Первая эксплуатация поезда на железной дороге;First Operation of a Train on a Railway;27.09.1825;событие;event
Изобретение первого парового двигателя;Invention of the First Steam Engine;01.01.1776;событие;event
Запуск первой паровой лодки;Launch of the First Steamship;01.01.1807;событие;event
Сражение при Седане;Battle of Sedan;01.09.1870;событие;event
"Публикация ""Новая Атлантида"" Бэкона";" Publication of ""New Atlantis"" by Bacon";01.01.1627;событие;event
Открытие Французской Полинезии;Discovery of French Polynesia;04.08.1767;событие;event
Подписание мирного договора в Версале;Signing of the Treaty of Versailles;28.06.1919;событие;event
Первая документированная экспедиция к Южному полюсу;First Documented Expedition to the South Pole;14.12.1911;событие;event
Смерть Рене Декарта;Death of Ren? Descartes;11.02.1650;событие;event
Первая атомная электростанция в СССР;First Nuclear Power Plant in the USSR;27.06.1954;событие;event
Изобретение электрического телеграфа;Invention of the Electric Telegraph;01.01.1837;событие;event
"Публикация ""Теория относительности"" Эйнштейна";" Publication of Einstein's ""Theory of Relativity""";30.11.1915;событие;event
Первая успешная операция по пересадке сердца;First Successful Heart Transplant;03.12.1967;событие;event
"Публикация ""Миф о Сизифе"" Камю";" Publication of ""The Myth of Sisyphus"" by Camus";01.01.1942;событие;event
Первая успешная почтовая связь через Атлантику;First Successful Transatlantic Mail Service;01.01.1866;событие;event
Запуск первой американской ракеты;Launch of the First American Rocket;20.10.1944;событие;event
Начало работы ООН;Establishment of the United Nations;24.10.1945;событие;event
Первая медицинская операция на открытом сердце;First Open-Heart Surgery;03.11.1952;событие;event
Начало работы первой коммерческой атомной электростанции;Start of Operation of the First Commercial Nuclear Power Plant;26.08.1954;событие;event
"Публикация ""Манифест коммунистической партии"" Маркса и Энгельса";" Publication of ""The Communist Manifesto"" by Marx and Engels";21.02.1848;событие;event
Первая эксплуатация электрического трамвая;First Operation of an Electric Tram;01.01.1881;событие;event
"Публикация ""Английская грамматика"" Брауна";" Publication of ""English Grammar"" by Brown";01.01.1761;событие;event
Ввод в эксплуатацию первого атомного ледокола;Commissioning of the First Nuclear Icebreaker;03.08.1959;событие;event
"Публикация ""Записки по натурфилософии"" Фихте";" Publication of ""Notes on Natural Philosophy"" by Fichte";01.01.1794;событие;event
"Публикация ""Сложные числа"" Картана";" Publication of ""Complex Numbers"" by Cartan";01.01.1925;событие;event
Запуск первой искусственной спутниковой связи;Launch of the First Artificial Satellite Communication;01.07.1963;событие;event
"Публикация ""По ту сторону добра и зла"" Ницше";" Publication of ""Beyond Good and Evil"" by Nietzsche";01.01.1886;событие;event
"Публикация ""Наука о логике"" Гегеля";" Publication of ""Science of Logic"" by Hegel";01.01.1812;событие;event
Первый полет в космос человека;First Human in Space;12.04.1961;событие;event
Первый публичный демонстрационный полет на самолете;First Public Demonstration Flight of an Airplane;17.12.1903;событие;event
Изобретение первой современной батареи;Invention of the First Modern Battery;01.01.1800;событие;event
Создание первой компьютерной программы;Creation of the First Computer Program;01.01.1843;событие;event
"Публикация ""Обыкновенная философия"" Мюллера";" Publication of ""Ordinary Philosophy"" by M?ller";01.01.1833;событие;event
Создание первого искусственного языка;Creation of the First Artificial Language;01.01.1887;событие;event
Запуск первой космической станции;Launch of the First Space Station;19.04.1971;событие;event
Первая успешная операция по пересадке почки;First Successful Kidney Transplant;23.12.1954;событие;event
Первая полномасштабная демонстрация электрического освещения;First Full-Scale Demonstration of Electric Lighting;01.01.1879;событие;event
Первая успешная почтовая связь между Европой и Америкой;First Successful Mail Service Between Europe and America;01.01.1866;событие;event
Начало эксплуатации первой железной дороги;Start of Operation of the First Railway;27.09.1825;событие;event
Первая успешная операция по пересадке легкого;First Successful Lung Transplant;05.06.1963;событие;event
Изобретение первого термоядерного реактора;Invention of the First Thermonuclear Reactor;01.01.1954;событие;event
"Публикация ""Огюстен де Сент-Экзюпери"" де Сент-Экзюпери";" Publication of ""Night Flight"" by Saint-Exup?ry";01.01.1931;событие;event
"Публикация ""Биография Франклина"" Пауэлла";" Publication of ""Franklin Biography"" by Powell";01.01.1904;событие;event
Первая успешная работа лазерного устройства;First Successful Operation of a Laser Device;01.01.1960;событие;event
Первая эксплуатация транспортного поезда;First Operation of a Freight Train;01.01.1825;событие;event
Изобретение первого телевизора;Invention of the First Television;01.01.1927;событие;event
Запуск первого космического зонда к Марсу;Launch of the First Mars Probe;05.11.1964;событие;event
Первый полет на реактивном самолете;First Jet Plane Flight;01.01.1939;событие;event
Первая успешная операция по пересадке печени;First Successful Liver Transplant;23.03.1967;событие;event
"Публикация ""Исследования о природе"" Коперника";" Publication of ""On the Revolutions of the Heavenly Spheres"" by Copernicus";01.01.1543;событие;event
Первая успешная операция по трансплантации органов;First Successful Organ Transplant Surgery;01.01.1954;событие;event
Запуск первой линии метро;Launch of the First Subway Line;10.01.1863;событие;event
Изобретение первого электродвигателя;Invention of the First Electric Motor;01.01.1832;событие;event
Открытие и исследование острова Рождества;Discovery and Exploration of Christmas Island;01.01.1643;событие;event
Создание первой модельной формулы в химии;Creation of the First Chemical Formula Model;01.01.1865;событие;event
Изобретение первого современного рентгеновского аппарата;Invention of the First Modern X-Ray Machine;01.01.1896;событие;event
Первая публичная демонстрация электрической лампы;First Public Demonstration of the Electric Lamp;31.12.1879;событие;event
Открытие острова Кука;Discovery of the Cook Islands;15.08.1773;событие;event
"Публикация ""Система логики"" Милля";" Publication of ""A System of Logic"" by Mill";01.01.1843;событие;event
Создание первой гипотезы о черных дырах;Creation of the First Black Hole Hypothesis;01.01.1783;событие;event
Первая успешная операция по пересадке кожи;First Successful Skin Transplant;15.09.1950;событие;event
Запуск первого атомного реактора;Launch of the First Nuclear Reactor;01.12.1942;событие;event
Первая успешная трансплантация почек;First Successful Kidney Transplant;23.12.1954;событие;event
"Публикация ""История искусств"" Винкельмана";" Publication of ""History of Art"" by Winkelmann";01.01.1764;событие;event
Изобретение первой модели радиопередатчика;Invention of the First Radio Transmitter Model;01.01.1895;событие;event
Первая успешная операция по пересадке органов;First Successful Organ Transplant Surgery;01.01.1954;событие;event
Изобретение первого атомного оружия;Invention of the First Atomic Weapon;16.07.1945;событие;event
Запуск первой спутниковой системы связи;Launch of the First Satellite Communication System;01.07.1963;событие;event
"Публикация ""Опыты"" Монтеня";" Publication of ""Essays"" by Montaigne";01.01.1580;событие;event
Открытие Южного полюса;Discovery of the South Pole;14.12.1911;событие;event
Создание первой модели телевизора;Creation of the First Television Model;01.01.1927;событие;event
Изобретение первого современного фотоаппарата;Invention of the First Modern Camera;01.01.1839;событие;event
Первая публичная демонстрация радиопередачи;First Public Demonstration of Radio Transmission;01.01.1901;событие;event
Изобретение первого современных автомобилей;Invention of the First Modern Automobile;01.01.1886;событие;event
"Публикация ""О революциях небесных сфер"" Коперника";" Publication of ""On the Revolutions of the Heavenly Spheres"" by Copernicus";01.01.1543;событие;event
Первая успешная трансплантация органов;First Successful Organ Transplant;01.01.1954;событие;event
"Публикация ""Этика"" Спинозы";" Publication of ""Ethics"" by Spinoza";01.01.1677;событие;event
Открытие острова Суматра;Discovery of Sumatra;01.01.1685;событие;event
Изобретение первого радиопередатчика;Invention of the First Radio Transmitter;01.01.1895;событие;event
Первая эксплуатация транспорта поезда;First Operation of a Freight Train;01.01.1825;событие;event
Запуск первой атомной электростанции в СССР;Launch of the First Nuclear Power Plant in the USSR;27.06.1954;событие;event
Изобретение первого фотоаппарата;Invention of the First Camera;01.01.1839;событие;event
Первая успешная трансплантация органов;First Successful Organ Transplant Surgery;01.01.1954;событие;event
Открытие химической структуры ДНК;Discovery of the Chemical Structure of DNA;28.02.1953;событие;event
Запуск первого спутника связи;Launch of the First Communications Satellite;04.10.1957;событие;event
Изобретение первой фотокамеры;Invention of the First Camera;19.08.1839;событие;event
Изобретение первого мотоцикла;Invention of the First Motorcycle;29.09.1885;событие;event
Изобретение первой спичечной коробки;Invention of the First Matchbox;07.02.1827;событие;event
Создание первой модели атомной электростанции;Creation of the First Nuclear Power Plant Model;01.01.1954;событие;event
Запуск первого искусственного спутника Земли;Launch of the First Artificial Earth Satellite;04.10.1957;событие;event
Изобретение первого паровоза;Invention of the First Locomotive;01.01.1804;событие;event
Запуск первого телескопа;Launch of the First Telescope;01.01.1609;событие;event
Первая успешная операция по пересадке органов;First Successful Organ Transplant;01.01.1954;событие;event
Изобретение первого фотоприемника;Invention of the First Photo Receiver;07.03.1873;событие;event
"Публикация ""Происхождение видов"" Дарвина";" Publication of ""On the Origin of Species"" by Darwin";01.01.1859;событие;event
Изобретение первого электромобиля;Invention of the First Electric Car;01.01.1828;событие;event
Открытие кислорода;Discovery of Oxygen;01.01.1774;событие;event
Изобретение первого парового двигателя;Invention of the First Steam Engine;01.01.1698;событие;event
Создание первой электромагнитной машины;Creation of the First Electromagnetic Machine;01.01.1820;событие;event
Запуск первого космического зонда;Launch of the First Space Probe;01.01.1958;событие;event
Создание первой модели самолета;Creation of the First Airplane Model;01.01.1903;событие;event
Изобретение первой модели трафаретного принтера;Invention of the First Stencil Printer Model;01.01.1876;событие;event
Запуск первой искусственной спутниковой системы связи;Launch of the First Artificial Satellite Communication System;01.01.1960;событие;event
Изобретение первой электрической лампы;Invention of the First Electric Lightbulb;01.01.1879;событие;event
"Публикация ""Второй книги природы"" Гассенди";" Publication of ""Second Book of Nature"" by Gassendi";01.01.1647;событие;event
Создание первого компьютера;Creation of the First Computer;01.01.1946;событие;event
Изобретение первой вычислительной машины;Invention of the First Computing Machine;01.01.1822;событие;event
Создание первого радиоаппарата;Creation of the First Radio Receiver;01.01.1895;событие;event
Изобретение первой модели электрического трамвая;Invention of the First Electric Tram Model;01.01.1881;событие;event
Открытие принципов термодинамики;Discovery of the Principles of Thermodynamics;01.01.1824;событие;event
Запуск первого спутника Земли;Launch of the First Earth Satellite;04.10.1957;событие;event
Создание первой вычислительной машины;Creation of the First Computing Machine;01.01.1822;событие;event
Запуск первой атомной электростанции в США;Launch of the First Nuclear Power Plant in the USA;01.01.1954;событие;event
Изобретение первой лампы накаливания;Invention of the First Incandescent Lamp;01.01.1879;событие;event
Открытие радиоактивных элементов;Discovery of Radioactive Elements;01.01.1896;событие;event
"Публикация ""Природные науки"" Коперника";" Publication of ""Natural Sciences"" by Copernicus";01.01.1543;событие;event
Изобретение первой модели электронной лампы;Invention of the First Electronic Valve Model;01.01.1904;событие;event
Открытие атомной структуры материи;Discovery of Atomic Structure;01.01.1913;событие;event
Изобретение первой фотографии;Invention of the First Photograph;01.01.1826;событие;event
Создание первого радиопередатчика;Creation of the First Radio Transmitter;01.01.1895;событие;event
Открытие структуры ДНК;Discovery of the Structure of DNA;28.02.1953;событие;event
Создание первой модели радиопередатчика;Creation of the First Radio Transmitter Model;01.01.1895;событие;event
Открытие радиоволн;Discovery of Radio Waves;01.01.1888;событие;event
Изобретение первой модели фотокамеры;Invention of the First Camera Model;19.08.1839;событие;event
Создание первой модели атомного реактора;Creation of the First Nuclear Reactor Model;01.01.1942;событие;event
Создание первого атомного реактора;Creation of the First Nuclear Reactor;01.01.1942;событие;event
Создание первой модели фотокамеры;Creation of the First Camera Model;19.08.1839;событие;event
Создание первой модели вычислительной машины;Creation of the First Computing Machine Model;01.01.1822;событие;event
Открытие закона гравитации;Discovery of the Law of Gravity;15.08.1687;событие;event
Введение системы двоичных чисел;Introduction of Binary System;08.03.1801;событие;event
Создание первого паровоза;Creation of the First Locomotive;21.02.1804;событие;event
Первая демонстрация электромагнитной индукции;First Demonstration of Electromagnetic Induction;29.08.1831;событие;event
"Публикация ""Критика чистого разума""";" Publication of ""Critique of Pure Reason""";01.01.1781;событие;event
Первая публичная демонстрация фотографической камеры;First Public Demonstration of a Photographic Camera;19.08.1839;событие;event
"Публикация ""Происхождения видов""";" Publication of ""On the Origin of Species""";01.11.1859;событие;event
Изобретение первого вакуумного насоса;Invention of the First Vacuum Pump;01.01.1650;событие;event
Первые эксперименты с рентгеновскими лучами;First Experiments with X-rays;08.11.1895;событие;event
Создание первого аэростата;Creation of the First Balloon;04.06.1783;событие;event
Изобретение первого телескопа;Invention of the First Telescope;01.01.1609;событие;event
Первое применение радио для связи;First Use of Radio for Communication;07.05.1897;событие;event
Создание первого электромагнитного двигателя;Creation of the First Electromagnetic Motor;01.01.1821;событие;event
Запуск первого искусственного спутника;Launch of the First Artificial Satellite;04.10.1957;событие;event
Изобретение первой лампы дневного света;Invention of the First Fluorescent Lamp;01.01.1938;событие;event
"Публикация ""Достижения и поражения""";" Publication of ""Achievements and Defeats""";01.01.1946;событие;event
Первая публикация о кибернетике;First Publication on Cybernetics;01.01.1948;событие;event
Первая успешная трансплантация легкого;First Successful Lung Transplant;05.06.1963;событие;event
Изобретение первого рентгеновского аппарата;Invention of the First X-ray Machine;01.01.1895;событие;event
Создание первой модели гиперболического реактора;Creation of the First Hyperbolic Reactor Model;01.01.1942;событие;event
Открытие принципов радиоактивности;Discovery of the Principles of Radioactivity;01.01.1896;событие;event
Запуск первого атомного реактора;Launch of the First Nuclear Reactor;01.01.1942;событие;event
Изобретение первой модели вакуумного насоса;Invention of the First Vacuum Pump Model;01.01.1650;событие;event
Создание первой модели термоядерного реактора;Creation of the First Thermonuclear Reactor Model;01.01.1954;событие;event
Первое применение электронного микроскопа;First Use of the Electron Microscope;01.01.1931;событие;event
"Публикация ""Теории относительности""";" Publication of ""Theory of Relativity""";01.01.1915;событие;event
Создание первого радиотелескопа;Creation of the First Radio Telescope;01.01.1931;событие;event
Изобретение первой модели спичек;Invention of the First Match Model;07.02.1827;событие;event
Изобретение первой модели паровоза;Invention of the First Locomotive Model;01.01.1804;событие;event
Создание первой модели электромагнитного двигателя;Creation of the First Electromagnetic Motor Model;01.01.1821;событие;event
Изобретение первого радиотелескопа;Invention of the First Radio Telescope;01.01.1931;событие;event
Создание первой модели электрического трамвая;Creation of the First Electric Tram Model;01.01.1881;событие;event
Изобретение первой модели вычислительной машины;Invention of the First Computing Machine Model;01.01.1822;событие;event
Изобретение первой модели термоядерного реактора;Invention of the First Thermonuclear Reactor Model;01.01.1954;событие;event
Изобретение первой модели лампы дневного света;Invention of the First Fluorescent Lamp Model;01.01.1938;событие;event
Изобретение первой модели лампы накаливания;Invention of the First Incandescent Lamp Model;01.01.1879;событие;event
Начало правления Елизаветы I в Англии;Elizabeth I Begins Reign in England;15.01.1558;событие;event
