Космический полет Юрия Гагарина;Yuri Gagarin's Spaceflight;12.04.1961;событие;event
Введение первой формы международной олимпийской гимнастики;Introduction of the First International Gymnastics Form;04.07.1896;событие;event
Основной договор о Севере Новой Англии;Treaty of the North of New England;22.08.1671;событие;event
Открытие Капитаном Джеймсом Кука Австралии;Captain James Cook Discovers Australia;19.04.1770;событие;event
Первое успешное испытание атомной бомбы;First Successful Atomic Bomb Test;16.07.1945;событие;event
Подписание Парижского мира;Treaty of Paris Signed;03.09.1783;событие;event
Открытие Великого Барьерного рифа;Discovery of the Great Barrier Reef;11.06.1770;событие;event
Создание ФБР в США;Creation of the FBI in the USA;26.07.1935;событие;event
Принятие Конституции США;Adoption of the US Constitution;17.09.1787;событие;event
Провозглашение независимости Бразилии;Declaration of Independence of Brazil;07.09.1822;событие;event
Изобретение первой подводной лодки;Invention of the First Submarine;01.01.1620;событие;event
Запуск первого комбайна для сельского хозяйства;Launch of the First Agricultural Combine;01.06.1834;событие;event
Первая вакцинальная кампания против оспы;First Smallpox Vaccination Campaign;01.05.1796;событие;event
Основание Мексиканской республики;Foundation of the Mexican Republic;27.09.1821;событие;event
Провозглашение независимости Гренады;Declaration of Independence of Grenada;07.02.1974;событие;event
Основной договор о Юго-Восточной Азии;Treaty of Southeast Asia;08.03.1954;событие;event
Создание первой модели телефонного аппарата;Creation of the First Telephone Model;10.03.1876;событие;event
Принятие Закона о гражданских правах в США;Passage of the Civil Rights Act in the USA;02.07.1964;событие;event
Основание Национального парка Йеллоустоун;Establishment of Yellowstone National Park;01.03.1872;событие;event
Открытие Аляски Россом Брюером;Discovery of Alaska by Rossom Brewer;18.08.1732;событие;event
Введение первой формы международного законодательства;Introduction of the First International Legislation Form;15.09.1864;событие;event
Провозглашение независимости Исландии;Declaration of Independence of Iceland;17.06.1944;событие;event
Провозглашение независимости Новой Зеландии;Declaration of Independence of New Zealand;28.09.1835;событие;event
Начало первого трансатлантического авиаперелета;First Transatlantic Air Flight Begins;08.06.1927;событие;event
Создание первой модели самолета;Creation of the First Airplane Model;17.12.1903;событие;event
Изобретение первой модели электрического холодильника;Invention of the First Electric Refrigerator Model;01.01.1913;событие;event
Введение первых международных почтовых марок;Introduction of the First International Postage Stamps;01.01.1840;событие;event
Создание первой модели двигателей внутреннего сгорания;Creation of the First Internal Combustion Engine Model;01.01.1876;событие;event
Первое применение антибиотиков в медицине;First Use of Antibiotics in Medicine;01.01.1928;событие;event
Провозглашение независимости Ливана;Declaration of Independence of Lebanon;22.11.1943;событие;event
Изобретение первой модели граммофона;Invention of the First Phonograph Model;12.11.1877;событие;event
Основание Всемирной Организации Здравоохранения;Foundation of the World Health Organization;07.04.1948;событие;event
Запуск первого искусственного спутника Луны;Launch of the First Artificial Moon Satellite;04.10.1957;событие;event
Изобретение первого электрического трамвая;Invention of the First Electric Tram;01.01.1881;событие;event
Введение первого международного кодекса валют;Introduction of the First International Currency Code;01.01.1890;событие;event
Открытие второго термоядерного реактора;Opening of the Second Fusion Reactor;15.08.1958;событие;event
Создание первой модели телевидения;Creation of the First Television Model;01.01.1927;событие;event
Запуск первого коммерческого космического полета;Launch of the First Commercial Spaceflight;01.01.1973;событие;event
Открытие первой модели самолета;Invention of the First Airplane Model;17.12.1903;событие;event
Первое успешное испытание ракетного двигателя;First Successful Rocket Engine Test;16.03.1926;событие;event
Провозглашение независимости Мальты;Declaration of Independence of Malta;21.09.1964;событие;event
Создание первой модели автомобилей;Creation of the First Car Model;01.01.1885;событие;event
Создание первой модели радиоприемника;Creation of the First Radio Receiver Model;01.01.1910;событие;event
Запуск первой модели космического корабля;Launch of the First Spacecraft Model;12.04.1961;событие;event
Открытие первого атомного реактора;Discovery of the First Atomic Reactor;02.12.1942;событие;event
Первое применение радиации в медицине;First Use of Radiation in Medicine;01.01.1896;событие;event
Провозглашение независимости Вьетнама;Declaration of Independence of Vietnam;02.09.1945;событие;event
Создание первой модели калькулятора;Creation of the First Calculator Model;01.01.1822;событие;event
Провозглашение независимости Португалии;Declaration of Independence of Portugal;05.10.1910;событие;event
Изобретение первой модели холодильника;Invention of the First Refrigerator Model;01.01.1913;событие;event
Провозглашение независимости Таиланда;Declaration of Independence of Thailand;24.06.1932;событие;event
Создание первой модели лазера;Creation of the First Laser Model;01.01.1960;событие;event
Провозглашение независимости Лаоса;Declaration of Independence of Laos;19.07.1949;событие;event
Создание первой модели электронной книги;Creation of the First E-Book Model;01.01.1971;событие;event
Изобретение первой модели светильника;Invention of the First Light Fixture Model;01.01.1859;событие;event
Провозглашение независимости Иордании;Declaration of Independence of Jordan;25.05.1946;событие;event
Создание первой модели компьютера;Creation of the First Computer Model;01.01.1946;событие;event
Запуск первого атомного подводного лодка;Launch of the First Nuclear Submarine;21.12.1954;событие;event
Изобретение первой модели фотоаппарата;Invention of the First Camera Model;19.08.1839;событие;event
Создание первой модели космического корабля;Creation of the First Spacecraft Model;01.01.1961;событие;event
Изобретение первой модели радио;Invention of the First Radio Model;01.01.1895;событие;event
Провозглашение независимости Мавритании;Declaration of Independence of Mauritania;28.11.1960;событие;event
Создание первой модели электровоза;Creation of the First Electric Locomotive Model;01.01.1879;событие;event
Изобретение первой модели стереоскопа;Invention of the First Stereoscope Model;01.01.1838;событие;event
Создание первой модели поезда;Creation of the First Train Model;01.01.1804;событие;event
Изобретение первой модели ракетного двигателя;Invention of the First Rocket Engine Model;01.01.1926;событие;event
Создание первой модели фотографии;Creation of the First Photography Model;19.08.1839;событие;event
Провозглашение независимости Ливии;Declaration of Independence of Libya;24.12.1951;событие;event
Изобретение первой модели двигателя внутреннего сгорания;Invention of the First Internal Combustion Engine Model;01.01.1876;событие;event
Создание первой модели электронного микроскопа;Creation of the First Electron Microscope Model;01.01.1931;событие;event
Изобретение первой модели калькулятора;Invention of the First Calculator Model;01.01.1822;событие;event
Запуск первого космического аппарата;Launch of the First Spacecraft;01.01.1958;событие;event
Создание первой модели электроника;Creation of the First Electronics Model;01.01.1952;событие;event
Изобретение первой модели компьютера;Invention of the First Computer Model;01.01.1946;событие;event
Создание первой модели космического зонда;Creation of the First Space Probe Model;01.01.1958;событие;event
Изобретение первой модели электроники;Invention of the First Electronics Model;01.01.1952;событие;event
Провозглашение независимости Того;Declaration of Independence of Togo;27.04.1960;событие;event
Изобретение первой модели электронной книги;Invention of the First E-Book Model;01.01.1971;событие;event
Создание первой модели лампы накаливания;Creation of the First Incandescent Lamp Model;01.01.1879;событие;event
Создание первой модели космической станции;Creation of the First Space Station Model;01.01.1971;событие;event
Изобретение первой модели электрического поезда;Invention of the First Electric Train Model;01.01.1879;событие;event
Изобретение первой модели телевизора;Invention of the First Television Model;01.01.1927;событие;event
Изобретение первой модели радиоприемника;Invention of the First Radio Receiver Model;01.01.1910;событие;event
Изобретение первой модели электромобиля;Invention of the First Electric Car Model;01.01.1828;событие;event
Создание первой модели космического аппарата;Creation of the First Spacecraft Model;01.01.1958;событие;event
Изобретение первой модели фотокамеры;Invention of the First Photocamera Model;19.08.1839;событие;event
Изобретение первой модели фотографии;Invention of the First Photography Model;19.08.1839;событие;event
Создание первой модели фотокамеры;Creation of the First Photocamera Model;19.08.1839;событие;event
Первое появление книги на английском языке;First Appearance of a Book in English;23.03.1567;событие;event
Появление первой газеты в Англии;Publication of the First Newspaper in England;02.11.1620;событие;event
Основание Нью-Йорка (тогда Новый Амстердам);Founding of New York (then New Amsterdam);21.09.1625;событие;event
Появление первой работы по аналитической геометрии;First Work on Analytic Geometry;01.01.1637;событие;event
Секретный договор о союзе между Францией и Нидерландами;Secret Alliance Treaty between France and the Netherlands;07.03.1678;событие;event
"Утверждение первого издания ""Медного всадника""";" Publication of the First Edition of ""The Bronze Horseman""";18.06.1770;событие;event
Введение первого закона о праве на землю в США;Enactment of the First Land Rights Law in the USA;20.05.1785;событие;event
Появление первой математической модели движения небесных тел;First Mathematical Model of Celestial Motion;03.12.1656;событие;event
Создание первого математического калькулятора;Invention of the First Mathematical Calculator;01.01.1670;событие;event
Публикация первого трактата по механике в Европе;Publication of the First Treatise on Mechanics in Europe;15.05.1727;событие;event
Появление первой химической таблицы элементов;Publication of the First Chemical Elements Table;01.01.1869;событие;event
Создание первой модели парового двигателя;Creation of the First Steam Engine Model;01.01.1712;событие;event
Первое использование атомной энергии для мирных целей;First Use of Nuclear Energy for Peaceful Purposes;01.01.1954;событие;event
Открытие первого атомного реактора;Discovery of the First Nuclear Reactor;02.12.1942;событие;event
"Публикация ""Происхождение видов"" Чарльза Дарвина";" Publication of ""On the Origin of Species"" by Charles Darwin";24.11.1859;событие;event
Первые эксперименты по генетике;First Genetics Experiments;01.01.1900;событие;event
Создание первого оптического телескопа;Invention of the First Optical Telescope;01.01.1608;событие;event
Разработка первого типа системной программы для компьютеров;Development of the First Operating System Software;01.01.1956;событие;event
Основание первой астрономической обсерватории;Establishment of the First Astronomical Observatory;12.10.1675;событие;event
Создание первой модели атомной бомбы;Creation of the First Atomic Bomb Model;16.07.1945;событие;event
Первое успешное использование рентгеновских лучей;First Successful Use of X-rays;08.11.1895;событие;event
Изобретение первого радиопередатчика;Invention of the First Radio Transmitter;05.12.1901;событие;event
Первый полет над Атлантическим океаном;First Flight Across the Atlantic Ocean;21.05.1927;событие;event
Открытие первого в мире музея;Opening of the First Museum in the World;01.01.1683;событие;event
Создание первой модели машины для писем;Invention of the First Typewriter;01.01.1868;событие;event
Появление первого образца электрической лампы;Invention of the First Electric Lamp Model;21.10.1879;событие;event
Публикация первого научного труда о фотографии;Publication of the First Scientific Work on Photography;09.08.1839;событие;event
Создание первой модели телефона;Creation of the First Telephone Model;04.03.1876;событие;event
Первые попытки создания вирусной вакцины;First Attempts at Creating a Viral Vaccine;01.01.1796;событие;event
Открытие первого в мире биологического резервуара;Discovery of the First Biological Reservoir;01.01.1852;событие;event
Создание первой модели электромобиля;Creation of the First Electric Car Model;01.01.1828;событие;event
Изобретение первого компьютера;Invention of the First Computer;01.01.1946;событие;event
Создание первой модели оптического телескопа;Invention of the First Optical Telescope;01.01.1608;событие;event
Первые эксперименты по радиотелефонии;First Experiments in Radiotelephony;01.01.1899;событие;event
Разработка первой модели медицинского рентгена;Development of the First Medical X-ray Model;01.01.1895;событие;event
Открытие первого в мире научного журнала;Publication of the First Scientific Journal;01.01.1665;событие;event
Создание первой модели акустического устройства;Invention of the First Acoustic Device;01.01.1877;событие;event
Публикация первого в мире научного труда о молекулярной биологии;Publication of the First Scientific Work on Molecular Biology;01.01.1965;событие;event
Первые успехи в области квантовой механики;First Successes in Quantum Mechanics;01.01.1925;событие;event
Первые эксперименты по созданию сверхпроводников;First Experiments in Superconductors;01.01.1911;событие;event
Открытие первого в мире научного института;Establishment of the First Scientific Institute;01.01.1773;событие;event
Создание первой модели лазера;Invention of the First Laser Model;01.01.1960;событие;event
Первые попытки создания программируемых машин;First Attempts at Creating Programmable Machines;01.01.1945;событие;event
Открытие первого в мире медицинского центра;Establishment of the First Medical Center;01.01.1891;событие;event
Создание первой модели рентгеновской трубы;Invention of the First X-ray Tube Model;01.01.1895;событие;event
Первые успехи в области биохимии;First Successes in Biochemistry;01.01.1930;событие;event
Создание первой модели воздушного шара;Invention of the First Hot Air Balloon;01.01.1783;событие;event
Первое успешное использование плутония в медицине;First Successful Use of Plutonium in Medicine;01.01.1944;событие;event
Разработка первой модели электромагнитной катушки;Development of the First Electromagnetic Coil Model;01.01.1820;событие;event
Публикация первого научного труда по радиоактивности;Publication of the First Scientific Work on Radioactivity;01.01.1898;событие;event
Создание первой модели цифрового компьютера;Invention of the First Digital Computer;01.01.1946;событие;event
Первая успешная операция по замене суставов;First Successful Joint Replacement Surgery;01.01.1960;событие;event
Изобретение первого транзистора;Invention of the First Transistor;01.01.1947;событие;event
Разработка первой модели микроскопа;Development of the First Microscope Model;01.01.1590;событие;event
Открытие первого в мире научного центра по космическим исследованиям;Establishment of the First Space Research Center;01.01.1958;событие;event
Создание первой модели фотоаппарата;Invention of the First Camera Model;01.01.1839;событие;event
Первая успешная операция по пересадке печени;First Successful Liver Transplant Surgery;01.01.1963;событие;event
Разработка первой модели полимерного материала;Development of the First Polymer Material Model;01.01.1907;событие;event
Изобретение первой модели рентгеновского аппарата;Invention of the First X-ray Apparatus Model;01.01.1896;событие;event
Публикация первого научного труда о генетических мутациях;Publication of the First Scientific Work on Genetic Mutations;01.01.1935;событие;event
Создание первой модели ядерного реактора;Invention of the First Nuclear Reactor Model;01.01.1942;событие;event
Первая успешная операция по замене сердца;First Successful Heart Transplant Surgery;01.01.1967;событие;event
Изобретение первого микрофона;Invention of the First Microphone;01.01.1877;событие;event
Создание первой модели самолетного двигателя;Invention of the First Aircraft Engine Model;01.01.1903;событие;event
Открытие первого в мире медицинского института;Establishment of the First Medical Institute;01.01.1785;событие;event
Первая успешная операция по трансплантации почки;First Successful Kidney Transplant Surgery;01.01.1954;событие;event
Создание первой модели батареи;Invention of the First Battery Model;01.01.1800;событие;event
Разработка первой модели калькулятора;Development of the First Calculator Model;01.01.1822;событие;event
Открытие первого в мире научного центра по биологии;Establishment of the First Biological Research Center;01.01.1928;событие;event
Публикация первого научного труда по химии;Publication of the First Scientific Work on Chemistry;01.01.1803;событие;event
Создание первой модели электрического двигателя;Invention of the First Electric Motor Model;01.01.1820;событие;event
Разработка первой модели медицинского оборудования;Development of the First Medical Equipment Model;01.01.1870;событие;event
Первое использование термоядерной энергии;First Use of Thermonuclear Energy;01.01.1952;событие;event
Изобретение первой модели электромагнитного двигателя;Invention of the First Electromagnetic Engine;01.01.1824;событие;event
Создание первой модели механической вычислительной машины;Invention of the First Mechanical Computing Machine;01.01.1837;событие;event
Открытие первого в мире медицинского лабораторного центра;Establishment of the First Medical Laboratory Center;01.01.1923;событие;event
Первая успешная операция по замене глаза;First Successful Eye Transplant Surgery;01.01.1965;событие;event
Разработка первой модели оптического волокна;Development of the First Optical Fiber Model;01.01.1970;событие;event
Изобретение первого цифрового калькулятора;Invention of the First Digital Calculator;01.01.1960;событие;event
Создание первой модели хирургического лазера;Invention of the First Surgical Laser Model;01.01.1965;событие;event
Публикация первого научного труда по астрофизике;Publication of the First Scientific Work on Astrophysics;01.01.1930;событие;event
